target,text
0,guns are for protection that shit really shouldnt be used unless your life in danger
1,train derailment in patna no news of any casualty so far
0,t shirts 10 male or female get wit me 2 days until its game changin time war zone single will be
1,@randerson62 watching news of wild fires and hope all is ok
1,@evahanderek @marleyknysh great times until the bus driver held us hostage in the mall parking lot lmfao
0,stony jackson is americas last hope as he leads an army of felons thus and army rejects against the army o satan
1,mad river complex fires have burned 14028 acres 8 contained the mad river complex fires in trinity county
1,breaking terror attack on police post #udhampur
1,arson suspect linked to 30 fires caught in northern california
0,fire hazard associated with installation of non compliant external cladding on by @wwwcbplawyers
0,mens cross body canvas waist packs solid letter print sports zipper bags coffee
0,finnish ministers fennovoima nuclear reactor will go ahead
0,when youre taking a shower and someone flushes the toilet and you have 1 second to gtfo or you get burned
0,dont think i can take anymore emotional wreck watching @emmerdale #summerfate @mikeparractor @misscharleywebb
1,@denisleary not sure how these folks rush into burning buildings but im grateful they do #trueheroes
0,@aptly engineerd there is no such curfew
0,uber reduces drunk driving fatalities says independent study
0,@christinalavv @lindsay wynn3 i just saw these tweets and i feel really attacked
1,suicide bomber kills 15 in saudi security site mosque #mercados
0,some guy whistled at me in the parking lot amp it did not help that the wind blew my skirt up getting in the car
0,too bloody hot in my room
1,2 injured 1 missing in bridge collapse in central mexico
0,@thetshirtkid im tryna smoke that mf out
0,@kumailn love your #irongiant t shirt on tonights #meltdown
0,new nanotech device will be able to target and destroy blood clots
1,wreckage conclusively confirmed as from mh370 malaysia pm investigators and the families of those who were
1,watch this airport get swallowed up by a sandstorm in under a minute
0,#nowplaying cliff richard i could easily fall in love with you amp shadows #internet #nieuws #radio on
1,@retiredfilth people in sydney woke up to the whole sky being red after a dust stormlike unreal
0,being bestfriends with your high school crush @yourboy shawn
1,thunder and lightning possible in the pinpoint foothill forecast
0,mike magner discusses a trust betrayed via @youtube #military #veterans #environment
0,get 150 free bets when you register at boylesports casino #luck #destroy
0,new level of tita dom bowling injury
1,#bestnaijamade 16yr old pkk suicide bomber who detonated bomb in bestnaijamade bestnaijamade bestnaijamade be
0,i still need to finish the lover but im watching this other drama for 8 hours now and im an emotional wreck so the lover needs to wait
1,msha stepping up enforcement after mining deaths via @elkodaily
0,@flunkie if it makes you feel any better im level 32 and still get demolished
1,3 former executives to be prosecuted in fukushima nuclear disaster
0,starting a gofundme page for a new set of rims since i demolished mine last night #helpabrotherout
1,riot police intervene after southampton and vitesse arnhem supporters clash fans clash in buildup to second leg
0,check out this item i just got phantasmal cummerbund #warcraft
0,i only fuck you when its half past five
0,@vacantldn this may be a peculiar compliment but i would be incapable of doing my research w out the desolate headspace your music provides
0,@raynbowaffair editor in chief @diamondkesawn releases issue #7 of #ramag #fashion #models and #mayhem
0,turn on your radios #stoponesounds is live on your #airwaves amp 1079 fm @stickynyc @95roots blazing all your hits
0,the legendary dutch producer dannic is making his way to denver to bring his progessive house sound to
0,now trending in nigeria police charge traditional ruler others with informant s murder
0,i must not fear fear is the mind killer fear is the little death that brings total obliteration
0,#aquarius women are not the vulnerable type so you do not have to worry about her she will survive all by herself
0,on this day in 1998 appetite for destruction goes to #1 on the billboard album charts and stay on for 57 weeks
1,rt abbswinston #zionist #terrorist kidnapped 15 #palestinians in overnight terror on palestinian villages
1,emergency units simulate a chemical explosion at nu suppose a student in the research labs at northwestern
0,gets on battlefield 3 screams into mic at cunts
0,we learn and grow and become stronger as we face and survive the trials through which we must pass #thomassmonson #lds #mormon
0,sex workers say credit card bans on online ads do more harm than good
1,fedex no longer to transport bioterror germs in wake of anthrax lab mishaps via @usatoday
0,feel like ive been flattened by a sumo wrestler no pain no gain #muaytai #wantmyabsback #strong
1,1 investigators say a virgin galactic spaceship crash was caused by structural failure after the co pilot unlocked a braking system early
1,#sinjar massacre #yazidis blast lack of action over hostages portland #phoenix #newyork #miami #atlanta #casper #iraq
1,lots of talk of how susceptible ny2 is to shoot blight with or without trama #wcfgt2015
1,maj muzzamil pilot offr of mi 17 crashed near mansehra today may almighty give strength to family to bear the loss
0,violent forces radio now playing agony storm of the apocalypse tunein player @
0,interview on the collapse of materialism best #talkradio listen live
1,gmtty mhtw4fnet officials alabama home quarantined over possible ebola case washington times
0,turkish newlyweds donate wedding money what a beautiful gesture still have faith in humanity
0,my phone looks like it was in a car ship airplane accident terrible
0,@bamagaga best part of today your song im to blame by @kipmooremusic is about to play on 1019 the twister
0,why are you engulfed by low self image take the quiz
1,#australia #news #japan marks 70th anniversary of #hiroshima atomic bombing read more
1,while the world screams terrorism assad buries civilians under the rubble of their homes #aleppo 05 08 2015 #syria
0,track apollo brown detonate ft mop @apollobrown @billdanzemop @famemop
0,uhhhhh demon hunters but not the whole burning crusade v 20 thing
0,if i cant ruin his mood then i may have lost my direction
0,another mac vuln
1,pic of 16yr old pkk suicide bomber who detonated bomb in turkey army trench released
0,this is the first time a tweet has blown up almost half a day later re
1,the latest more homes razed by northern california wildfire abc news
0,my dog just farted evacuate this fuckin room disgusting ass broom lookin ass
0,@elianaraquel like gg was bad in the end but at least i cared a little when gg was dan cause it was a twister i dont know wilden idc
0,in the movie titanic jack and rose both could have stayed on the wooden beam without it sinking
1,arson suspect linked to 30 fires caught in northern california
0,associated agencies inc is #hiring property amp casualty account manager #jobs #rollingmeadows #insurance
0,this friday palm beach county #grindhouse series one night screening of #texaschainsawmassacre @morbidmovies
0,@stankyboy88 i shouldve photo bombed
0,2pcs 18w cree led work light offroad lamp car truck boat mining 4wd flood beam full rea
1,must see massive isis suicide truck bombing caught on tape via @gabbyogbechie1tpgazette
0,@lizhphoto when i have so much shit going on in my head id rather talk about it than have an outburst displaced aggression sux
0,disillusioned lead character check happy go lucky free spirit girl check dream life crushed check great music check all crowe tropes intact
0,brass and copper in cataclysm amp aftershock
1,myanmar floods occur during low season for river cruising pandaw river expeditions is currently operating only t
0,i think ill get obliterated tonight
1,@myralynn24 becuase it can cause property damage and cause wild fires
0,you can t research collective memory the 1st rule of writing diverse should be dont touch another groups tragedy
0,well crash down like an avalanche
0,ill let louis drown me at the water wall by the mall if that makes him smile
0,yo i got bars and im not even a rapper
0,love wounds
1,officer wounded suspect killed in exchange of gunfire richmond police say an officer has been wounded and a
1,#newswatch 2 vehicles collided at lock and lansdowne sts in #ptbo emerg crews on their way
1,a new tropical cyclone is forming near guam once it is formed it will be called molave
0,hey how are you
1,sinkhole selfies you wont believe whats in the brooklyn sinkhole sinkhole selfies you wont belie
1,something frightening is happening to the weather in the middle east
0,niagara falls package deals deluge tours yyeso
1,bbc news india rail crash trains derail in madhya pradesh flash flood
1,hey @macys my moms house burned down in the ca wild fires amp i bought her an e gift card to buy her clothes cont
1,humboldt cty sheriffs office has issued an evacuation advisory for 10 residence in the lassics area more info at
0,human history becomes more and more a race between education and catastrophe
0,i liked a @youtube video minecraft night lucky block mod bob apocalypse wither 20 amp more mod showcase
0,once thought dead google glass gets a second coming though considered an epic failure according to its makers and a recent patent
1,#japan #fukushima the most serious man made disaster in human history a marker of radiation brain damage
0,crush cars with wrestling stars in mmx racing featuring wwe appadvice #designgeeks
0,want to work in #tarzana ca view our latest opening #nursing #job #jobs #hiring
1,the hatchet wielding gunman had pepper spray and a fake bomb
1,new post suicide bomber kills 13 at saudi mosque
0,im a disaster
0,upheaval high note for bush opera #sydney #news #aus
0,@eac4au you can now pre order the film on itunes amp watch 9 15 yay
0,@burberryant bleeding on the brain dont know the cause
0,i spent 17 minutes walking with runkeeper 90 calories burned #loseit
0,rmt is playing jackson browne before the deluge listeners 2 100 requests are on
1,hundreds feared drowned as migrant boat capsizes off libya
1,there are multiple buildings on fire in downtown hinton ok the fire is threatening to level the entire block #8nn
1,kcem jeff king reports a level 3 evacuation east of roosevelt from whitner rd to the county line between sr14 amp hale rd
1,twelve feared killed in pakistani air ambulance helicopter crash
1,#breaking #la refugio oil spill may have been costlier bigger than projected
1,a group of florida forest service firefighters could be deployed to california to help contain fires details at 10
0,when youre 5 hours late for curfew and have to pray your dog doesnt bark when unlocking the door
1,in memory of the victims of hiroshima and nagasaki never again ban nuclear weapons
0,new post people are finally panicking about cable tv
0,@birdyword nice piece you wrote on #rbs sale think sunk cost fallacy disposition effect
0,shout out to fishtails your 75 cent natty light cans are going to be obliterated by yours truly
1,hwrf absolutely lashes taipei with hurricane force winds high storm surge and 20 of rain not good news at all
0,@lt3dave so many specs so much fan service so much lore destruction
0,ouvindo peace love amp armageddon
1,its been 70 years and one hour since the bombing of hiroshima lets take this time to remember
1,interesting approach but doesnt replace eyewitness video the ferguson case video
0,i liked a @youtube video marvel vs dc avengers battle
0,16 stylishly unique houses that might help you survive the zombie apocalypse
0,@pandamoanimum duly notedthe involuntary wince i have when people send me words like holibobs must make it look like i have trapped wind
0,rescue of the day it s world cat day saturday aug 8th black black white cats just 5 #newbeginningsanimalrescue
0,simmering beneath #nhl good times the leagues own concussion issues @pioneerpress
1,hi res doppler showing storm just ne of edmond is now severe with 125 hail and 60mph wind possible #okwx
0,want to meet @incubusband earn your way by watching @thematthewcookes #survivorsguidetoearth #incubustour2015
0,i bet you didnt know i kick box too
0,@who mikejoness i hate seeing the boy get fucking demolished like this
0,if you have an opinion and you dont put it on thh internet you will furst into flames
1,video were picking up bodies from water rescuers are searching for hundreds
0,hellfire is surrounded by desires so be careful and don t let your desires control you #afterlife #islam
0,drunk twister is so hard
0,dont say @alipaper women got problems this #keepingtheviginaclean thing is very interesting n less expensive #metrofmtalk
0,the insides of the explosion box get it customized the way you want #dcubecrafts #greetingcards
0,i liked a @youtube video from @slimebeast town of salem how to win as the arsonist
1,scene of the derailment cta green line at 63rd prairie
0,@andreajmarkley @edjschenk @sentedcruz if you call forward sinking into a cesspool you might be right
0,@king naruto as long as i see madara bleeding im good
1,one man fatally shot another wounded on vermont street #buffalo
1,families to sue over legionnaires more than 40 families affected by the fatal outbreak of legionnaires disea
0,@charlieputh that song have a cool beat like nothing but trouble
0,im an emotional wreck watching emmerdale fml
0,having trouble understanding the rotations within a left leaning red black tree my class is currently learni
1,drove past the field on fire yesterday reminded me of the bush fires we used to get in south africa
0,usa today @fedex will no longer to transport bioterror pathogens after #newsintweets
0,@dead last im going to live out of my car for a year probably 2016 life goals
0,already expecting to be inundated w articles about trad authors pay plummeting by early next year but if this is true itll be far worse
0,the burning legion has returned
0,@rakestrawjeff @gop that about sums it up give them a historic landslide and they do everything king barack wants its just incredible
0,detonation fashionable mountaineering electronic watch water resistant couples leisure tab
0,today your life could change forever #chronicillness cant be avoided it can be survived join #mylifestory gt gt gt
0,@tinyjecht are you another stand user if you are i will have to detonate you with my killer queen
0,i liked a @youtube video mini pony packs a punch live report from the salem county fair on cbs3 eyewitness
0,the satisfaction of knowing you flattened someone with logic and reasoned argument
0,how many sons would a parson parse if a parson could parse sons popular tongue twister among religious woodchucks
1,tomorrows evening commute receives a red light a rainstorm impacting the region will push its way in late evening
0,to all the meat loving feminists of the world riot grill has arrived
0,im a hurricane
0,rt @rtrrtcoach #love #truelove #romance lith #voodoo #seduction #astrology #rtrrt #lotz 9 11 #apocalypse #armageddon #1008planet
1,#breakingnews experts in france begin examining airplane debris found on reunion island french air accident e
0,just realized that maybe it not normal to sit up front with an uber driver panicking
1,suicide bomber hits saudi mosque
1,traffic collision ambulance enroute florin rd at franklin blvd south sac
1,rt abbswinston #zionist #terrorist kidnapped 15 #palestinians in overnight terror on palestinian villages
0,@daewony0406 alright now im gonna crash im so exhausted
0,@scotto519 happy birthday young blood
1,landslide in italian alps kills three rome reuters three people were killed when a severe rainstorm in th
1,more wicked weather rolls through calgary and surrounding areas
1,19000 homes destroyed in gaza zero rebuilt join me in busting the blockade sign amp rt #gaza #opengaza
1,the murderous story of america s first hijacking
0,permits for bear hunting in danger of outnumbering actual bears the licenses for floridas fir #st petersburg
0,very glad that you got obliterated in x men first class you fully deserved it after all @kevinbacon soz
0,seeing hazard without the beard like
0,aggressively screams
0,@lenn len probably we are inundated with them most years
0,its the best time of day @siren voice is #liveonstreamate
1,twelve feared killed in pakistani air ambulance helicopter crash
1,wreckage conclusively confirmed as from mh370 malaysia pm investigators and the families of those who were
1,#australia #news rt janeenorman high probability aircraft wreckage is from #mh370 according to deputy prime
0,the only thing that stands between you and your dream is the will to try and the belief that it is actually possible joel brown
1,#tweetlikeitsseptember11th2001 those two buildings are on fire
1,the people who tweet and care about #japan #fukushima nuclear disaster are not the problem those who ignore are the problem
0,and my dad is high i have a dysfunctional family
0,hey bitch blow me uh no stick your dick in some water then an outlet so u get electrocuted
1,turkish troops killed in kurdish militant suicide attack
1,suicide bomber kills 15 in saudi security site mosque reuters canada reuters canadasuicide bomber kills 15
0,dont think ive ever been this close to a mental explosion in so long
1,suicide bomber kills 15 in saudi arabia mosque used by the police is claims responsible for barbarism
1,#hungerarticles nepal rebuilding lives and livelihoods after quake devastation
1,navy no charges against officer for weapons violations in chattanooga attack
0,5 seconds of summer is my pick for fan army #5sosfam 1
0,@mrsbinker @emiliorivera48 @davidlabrava mine are diesel and twister both small for the breed but very strong i have a beautiful pug too
0,spot flood combo 53inch 300w curved cree led work light bar 4x4 offroad fog lamp full re
1,more gt osha officers on siteinvestigating noranda explosion kfvs12 news cape girardeau carbondale poplar bluff
0,@thesewphist whoever holds the address fuckface@wineisdumbcom is going to be deluged in spam meant for me
1,obama declares disaster for typhoon devastated saipan
0,but time began at last to obliterate the freshness of my alarm
0,can you save can you save my can you save my heavydirtysoul
1,@traffic southe @roadpol east accident on a27 near lewes is it kingston roundabout rather than a283
0,ks except every character is shizune the world would explode
1,japan marks the 70th anniversary of the atomic bombing of hiroshima
0,posted a new song earthquake
0,graham phillips fundraiser canceled by @justgiving #fundraise #ukraine #donbas
0,have to laughtraders panicking over market down 1 some see these as positive capitulation thats a joke more to come may be ugly
1,ive just posted on my blog about criminals who hijack lorries and buses arrested in enugu photo
1,whao 12000 nigerian refugees repatriated from cameroon
1,governor allows parole for school bus hijacker liveleakfun
0,beware of your temper and a loose tongue these two dangerous weapons combined can lead a person to the hellfire #islam
0,igers 3 words that wrecked disneys stock
0,i s2g if anyone tries to harm my cupcake ill fucking hunt you down to the end of the earth #harrybecareful
1,suicide bomber kills 15 in saudi security site mosque a suicide bomber killed at least 15 people in an attack on
0,no better feeling than seeing and being on stage with my day ones 22 year friendships and we still body bagging mics together
0,apply now to work for dignity health as #rn #emergency services full time 7a 7 30p siena campus in #henderson #jobs
0,lava dragon breeder i just bred a lava dragon in dragonvale visit my park to check it out
0,its a trap not a fucking game u aint trapping if u aint trapped
1,motorcyclist bicyclist injured in denver collision on broadway at least two people were taken to a local
1,fears over missing migrants in med rescuers search for survivors after a boat carrying as many as 600 migrants
1,@aria ahrary @thetawniest the out of control wild fires in california even in the northern part of the state very troubling
0,businesses are deluged with invoices make yours stand out with olour or share and its likely to rise to the top of the pay pile
1,obama declares disaster for typhoon devastated saipan obama signs disaster declaration for northern marians a
0,the wounds of honor are self inflicted
1,@itsqueenbaby im at work its a bunch of ppl and buses because the train derailed
0,@trap vodka my new fave vine
1,rip rt @ajenews on aug 6 1945 at 8 16 am tokyo time the world s 1st atom bomb on hiroshima
0,@imawesome7986 like literally blew up
0,@argentaelite haha traumatised hell no i want a job xxx
1,#harperanetflixshow blazing saddles a show about wild fires in alberta
0,@chrisman528 fatality
0,changelessly handle dominant quarantine folders toward yours solemnity hjt
1,apd investigating fatal shooting of 3 year old child in southeast anchorage
0,oh shelly your waffle wasnt a little blonde your waffle was madonna circa 1987 #nowyouknow #masterchef
1,video were picking up bodies from water rescuers are searching for hundreds of migrants in the mediterran
0,q why do ducks have big flat feet a to stamp out forest fires q why do elephants have big flat feet a to stamp out flaming ducks
0,@cash7nigga whoa insomniac why dont you try to get some sleep sleep heals all wounds food too night
1,today marks 70 years since the mass murder of 140000 civilians in hiroshima the bombing of hiroshima and nagasaki did not end ww2
0,why do u ruin everything @9tarbox u ruined the sour cream and u put a brick of cheese in the freezerdummy
1,suspect in latest us theatre attack had psychological issues
1,we are getting some reports of flooding near jonesboro high school please use caution when driving in the area turn around dont drown
1,obama declares disaster for typhoon devastated saipan obama signs disaster declaration for northern marians a
1,obama declares disaster for typhoon devastated saipan obama signs disaster declaration for northern marians a
0,@ellenfromnowon 7 speed nexus shifter 9 for community cargo bike
0,please tell me ross isnt actually dead i hope theyre just playing us until the next episode #emmerdale
1,@financialtimes ethiopian regimes continue receiving foreign aid when famine struck for 2 years eastern ethiopia
0,end the innovation catch 22 reduce the attack surface #industryinsights #mcgsecure
1,17 killed in s arabia mosque suicide bombing a suicide bomber attacked a mosque in aseer south western saudi
1,calgary takes another beating from summer storms city activates emergency plan it was another day of watching the
0,if all men sauntered like fred i think id be in trouble #shallwedance #summerunderthestars #tcmparty
0,@memenaar but the design decision to lets make something fresh and beautiful and wonderful and then wreck it is kindof odd in restrospect
1,calgary takes another beating from summer storms city activates emergency plan
1,#news madhya pradesh train derailment village youth saved many lives #til now #ndtv
1,video were picking up bodies from water rescuers are searching for hundreds of migrants in the mediterran
0,loan upheaval is the way in which oneself can save your house leaving out being foreclosed ontejc
1,legionnaires disease whats being done to stop deadly outbreak the worst ever outbreak of legio #losangeles
0,when high fashion and food collide gucci has chosen one of shanghai s most popular commercial avenue #fashion
0,a real life tragedy monicas hair on any given season of friends
0,#askconnor theres a zombie apocalypse the item to your right is your weapon youre either screwed or youre gonna live
0,smoke eat sleep
0,you know how they say the side effects low amp really fast son the product was an acne cream why 1 of the side effects was bloody diarrhea
0,@rohnertparkdps youre on stage now right under the lights isnt it funny where do you get the goofballs with which you staff your pd
1,@michael5sos california is in a drought what are you gonna do about this issue if you want to be president this attitude wont work with m
0,has an ancient nuclear reactor been discovered in africa your
0,serephina the siren lt 3
1,asad is also a mass murderer
0,@blackhatwriter yeah im going to be at home by a computer for the next two weekends getting really burned out really quick
0,gop plan to destroy public education cut teacher pay and even make them buy their own school supplies pure evil
0,dragon ball z battle of gods 2014 rotten tomatoes via @rottentomatoes
0,and bleach your skin after touching that thong shudder that and all the boudoir outfits my eyeballs are bleeding amp my brain has exploded
1,army sources say 12 persons on board including a team of doctors die in helicopter crashed near mansehra weather seems to be cause of crash
1,rt @livingsafely #nws issues severe #thunderstorm warnings for parts of #ar #nc #ok expect more trauma cases
0,#hot funtenna hijacking computers to send data as sound waves black hat 2015 #prebreak #best
1,the latest more homes razed by northern california wildfire
1,terrorist attack in #udhampur district in j amp k 2 spos injured
1,strong thunderstorm 4 miles north of japton moving se at 25 mph large hail and wind gusts up to 50 mph poss #arwx
0,@cameronhigdon34 i cant drown my demons they know how to swim
0,the circular ruins displaced part 4 #nowplaying
1,good thing there was actually just a legit fire in the mall and nobody evacuated
0,the schematization to maintain facts dependable by virtue of obliterationxmwte
0,@lovelylikelaura i can see why one of your favorite books is beautiful disaster it may now be one of mine
0,my worst fear
0,#hot funtenna hijacking computers to send data as sound waves black hat 2015 #prebreak #best
0,but no lies though its pays to be the oldest sometimes like being the first to get a car and have no curfew #freedom #donthate
