target,text
1,mafireems rt wmur9 two buildings involved in fire on 2nd street in #manchester wmur9 via kcarosawmur
0,i added a video to a @youtube playlist s@x 109 sws fatality captain falcon vs snow fox ssb4 losers
1,large fire burning several buildings causing evacuations in downtown hinton
0,mango juice with crushed ice gt gt gt gt
0,praise god that we have ministry that tells it like it is #now #wdyouth #biblestudy
1,# # # # udhampur terror attack militants attack police post 2 spos injured times of
0,#funfact #facts can stars collide
1,myanmar floods childfund and international needs and care aust @careemergencies appeals
0,theyre training all the celebrities 2 b superheroes so wen the apocalypse occurs theyll survive repopulate earth w superior hot beings
1,car vs motorcycle in harwich port harwich port a car and motorcycle collided around 5 30 pm the crash happen
0,@mi country hick pfft i wish i had a bot like that instead im daily inundated with 140 characters of the same unhinged machismo bullshit
1,police assailant in latest us movie theatre attack was homeless had psychological issues
1,#sismo detectado #jap n report 1 01 01 56 okinawa island region m40 depth 10km maximum seismic intensity 3 jst #
1,#kamindoz #reuters debris confirmed from mh370 relatives hope for discovery of crash s
0,100 1 mix new flat double sided linerless bottle caps you choose mix flattened full re
0,was that thunder
0,the whole of new zealand is shouting bloody marvellous john campbell to join radio nz #radionz
0,dont panik #kelbytomlinson to the rescue
1,green line train derails on south side passengers safely evacuated cta says
0,vinnie jones goes on the beat with northumbria police
0,@klavierstuk doesnt so lvg is forced into the market may beat spurs and smaller teams with blind lcb top 4 cl teams will obliterate us
1,video fire burns two apartment buildings and blows up car in manchester
1,uae cool to mideast heat wave rain watch latest video ncms issues warning of thundering rain poor visibility
0,cool tips from our friends at counterstrike security amp sound
0,#artisteoftheweekfact say #conversations by #coast2coastdjs agree @crystal blaz s #jiwonle is a #hiphop #clubbanger
0,@aphyr i ve been following you this long sunk cost fallacy or somethin
0,learn how i gained access to the secrets of the top earners amp used them to explode my home business here please #rt
0,i liked a @youtube video j cole fire squad 2014 forest hills drive
1,#flood #disaster bengal floods cm mamata banerjee blames dvc bjp claims state failed to use economic t
0,i really wanna brownie batter blizzard
0,what if i want to fuck the duck until explode it could be greasy
0,@astros stunningly poor defense its not all on the pitcher if our bats are mia like the top of 1st inning this team is in trouble
1,#rohingya houses in #kyee nockthie hamlet from taungbazar region in buthidaung were severely damaged in cyclone @kasitaroch @vivianunhcr
1,potus #strategicpatience is a strategy for #genocide refugees idp internally displaced people horror etc
0,genuine leather man bag messenger fit ipad mini 4 tablet case cross body air jp full rea
0,insurance news texas seeks comment on rules for changes to windstorm insurer
0,@kimkardashian can you please sign and share this petition to save wild horses in arizona
1,new two giant cranes holding a bridge collapse into nearby homes
0,apollo brown detonate f mop
1,calgary area tornado warnings end as thunderstorms move eastward cbcca cbcca calgary area tornado warnings end
0,@we3fordemocracy it already happens abs and rowers tweeting support for nats last year and the deluge of celeb endorsements for obama in 08
0,why are you feeling desolate take the quiz
0,you da one #mtvsummerstar #videoveranomtv #mtvhottest britney spears lana del rey
0,ancient mayan tablet found via
1,my father walked through the devastation the day after and refuses to speak about it to this day
0,love god more than you fear hell
0,black eye 9 a space battle occurred at star o784 involving 2 fleets totaling 4103 ships with 50 destroyed
0,pos nose que hago escuchando sleeping with sirens iris goo goo dolls cover ke pedo
0,@rokiieee the game has officially collapsed
0,fuck neil go fall off a cliff or something#yr
1,motorcyclist bicyclist injured in denver collision on broadway
1,the pak terrorist who has been caught alive must be tried fast not delayed as kasabwe must send very hard message to pak instead of biryani
0,#gamergate the end of reddit is coming its time we devise an emergency evacuation plan
1,severe t storm warning for union county 3 45pm top threats include heavy rain lightning amp damaging winds
0,heart sinking like a sunset
0,everyone starts a #ux project with the best intentions but common pitfalls happen along the way dont let them
1,obama declares disaster for typhoon devastated saipan obama signs disaster declaration for northern marians a
1,christian attacked by muslims at the temple mount after waving israeli flag via pamela geller
1,sinkhole closes falmer drive in bethlehem township
1,arson suspect linked to 30 fires caught in northern california
1,bomb head explosive decisions dat produced more dead children than dead bodies trapped tween buildings on that day in september there
1,new evacuation ordered for 25 homes in danger of hwy 8 fire near roosevelt wash #koin6news
1,@thomashcrown my grandfather was set to be in the first groups of marines to hit japan in operation olympic 95 casualty rate predictions
0,wow bro blew up quick believe it or not hes this funny and clever in person at all times you be like where
1,calgarians stunned by storm insurance companies busy handling calls #abstorm
0,#lonepine remembered around australia as descendants grow via @666canberra #gallipoli #ww1
0,@team barrowman just saying your my man crush
1,news update huge cliff landslide on road in china watch the moment a cliff collapses as huge chunks of rock fall
1,consent order on cleanup underway at csx derailment site knoxville news sentinel
1,@asgharchohan86 @adilghumro there are floods in kpk because you guys couldnt build dams in 30 years you ruled even for your own thar
1,severe thunderstorm warning remains for #cochrane @cityofcalgary has enacted municipal emergency plan after todays storm #abstorm
0,why put out a fire when its still burning
0,microsoft xbox 360 console rrod red ring of death as is for parts or repair full read by
0,@alexbelloli i do it just seemed like the pages were out of order
0,its crazy how a phone can do so much damage to a person
0,@lisavanderpump how many dogs do you have and are they all rescue dogs
1,i 77 mile marker 31 south mooresville iredell vehicle accident ramp closed at 8 6 1 18 pm
1,another white mass murderer thank god im from california @frautrapani
1,refugio oil spill may have been costlier bigger than projected
0,patrick roy 1998 99 upper deck spx #171 finite 1620 made colorado avalanche mint
1,malaysia confirms plane debris washed up on reunion island is from flight mh370
0,twitter is just here to destroy your childhood
1,16 dead in russia bus accident at least 16 people were killed and 26 others injured when two buses collided i
1,sooooo shooting up movie theaters the new mass murderer wave
0,i liked a @youtube video from @dannyonpc battlefield hardline 11 new weapons new map throwingknifes
0,last night was a ball atop a 40 ft fire truck latter #nno2015
0,dazzle destroy the fun
0,i ran with earbuds in which i now realize means i probably didnt politely say hi to jared but more or less screamed at him
0,worlds collide when an american family takes over britains isle of man in new tlc show suddenly royal via @people
1,#earthquake #sismo m 19 5km s of volcano hawaii time2015 08 06 01 04 01 utc2015 08 05 15 04 01 10 00 at
0,a spider has legit just run across my chest traumatised for life
1,dutch crane collapses demolishes houses dramatic eyewitness video captures the moment a dutch crane hoisting
0,ball has no curfew
0,new snap on tools black baseball hat cap silver gray embroidered s logo flames full re
0,i may have gotten a little too exited over my home made lava lamp
0,@sunkxssedharry will you wear shorts for race ablaze
0,cascada evacuate the dancefloor official video via @youtube
0,mega keen for hiking tomorrow hope i dont fall off a cliff haha #keen #fitness #yay #excitedmuch
0,and if i cry two tears for her that will be the most that i would give
0,@cameronciletti @tigersjostun i can destroy u
1,fedex no longer to transport bioterror germs in wake of anthrax lab mishaps via @usatoday
0,training grains of wheat to bare gold in the august heat of their anger im the no trespass lest you seek danger
0,illusoria icarus nowplaying check out
1,sioux city fire officials believe bridge collapse lead to cement truck roll over siouxland matters siouxlan
0,during drag me down last night i was screaming shell of a mannequin instead of shell of a man and i think everyone hated me there
1,@marc holl @nennicook @aitchkaycee @vixstuart @benjbeckwith its not pretty #disaster #gbbo #mudslide
1,video were picking up bodies from water rescuers are searching for hundreds of migrants in the mediterranean
1,global precipitation measurement satellite captures 3 d image of typhoon soudelor @nasahurricane
1,flood zone general raheel sharif visits chitral he also lauded the efforts of fwo army troops and army aviation in rescue opera
1,tonight we have attended a fire in romford with @londonfire thankfully no injuries
1,wreckage conclusively confirmed as from mh370 malaysia pm investigators and the families of those who were
0,my workplace is going to be pandemonium when the season starts
0,@widow elena @stelena always the show sunk because of de are you really that blind keep trying with me though
0,us wants future first responders to be more high tech
1,dr gridlock here s what may have caused a metro train to derail in downtown dc #washingtonpost
0,stretcher in 5 min speaker deck
0,damn theres really no mlk center that hasnt sunk in yet
1,fully engulfed garage fire propane tanks inside sunnymeade dr
1,the latest more homes razed by northern california wildfire abc news
1,windstorm lastingness perquisite acquiesce in a twister retreat ziuw
1,rt watchmanis216 #sinjar massacre #yazidis blast lack of action over hostages portland #
0,@jaureguiswisdom lmao well i only know one and ive only had a crush on this one sooo
0,did harry survive the show
0,deadpool is already one of my favourite marvel characters and all i know is he wears a red suit so the bad guys cant tell if hes bleeding
1,what person would possibly make a horror film about the isla vista massacre in order to make money off of our tragedy
1,cleared accident with property damage on #ny35 eb at ny 100
0,i have my final tomorrow ish is stressful but ill survive
1,satelite shot series of wildfires in northern california continue blazing there are at least five fire compl
0,eggs desolate
1,flooding kills 166 displace over one million in pakistan daily news amp analysis
1,update evaucation order for roosevelt wa has been lifted
1,heat wave is relentless 91 f feels like 100 humidity 55 relentless drought too now dominicana i know is worse in other places
1,the latest more homes razed by northern california wildfire abc news
1,severe weather bulletin no 5 for typhoon #hannaph soudelor tropical cyclone warning issued at 5 00 pm 06
0,the grenade sound effect on impossible just destroyed about 10 other hoes careers
1,wreckage conclusively confirmed as from mh370 malaysia pm investigators and the families of those who were
1,the latest more homes razed by northern california wildfire abc news
0,@lisatoddsutton the reason i bring this up bcz he is running 4 senate murphy is nothing but a republican i am deluged with his junk mail
0,im not the mom friend but i still see my friends as my little babies that i have to care for or else theyll electrocute themselves
0,holy fuck someone set me on fire
1,obama declares disaster for typhoon devastated saipan obama signs disaster declaration for northern marians a
0,keep up the great work councilman brian oneill
1,70 years after hiroshima and nagasaki consequences of a nuclear detonation @icrc
0,okay i need all of you to evacuate the house so i can write this poem
0,cramer iger s 3 words that wrecked disney s stock cnbc
0,that ball was crushed
0,bear markets are driven by fear and fear has taken over many european markets dont
1,and kolkata is struck by a cyclonic storm sumthng big is gonna happen 2day evng heavy rains nd a violent storm approachng god help us
1,video were picking up bodies from water rescuers are searching for hundreds of migrants in #africa #news
0,my parents dont believe in the dream sad
0,womens buckle casual stylish shoulder handbags pockets cross body bags white
0,canberras currong apartments marked for demolition in september
0,it is not always friendship when kisses show up neither is it always enemity that shows up when wounds show up #bishopfred
0,no more warpeople need no any weapon we need the world of peace
0,check out want twister tickets and a vip experience to see shania click here at i would love love love to win
0,canceling deal for 2 warships #france agrees to repay #russia via @nytimes
0,reddits new content policy goes into effect many horrible subreddits banned or quarantined
0,moved on to bang bang rock and roll by @art brut its been too long since ive played this one loud art brut top of the pops
0,when you realize you could have been electrocuted last night because you grabbed this in the dark how
1,@prsnvns thats good to hear mine could be better but i can manage its alright you do what you have to bioterrorism doesnt wait
1,governor allows parole for school bus hijacker
0,bedroom clean bathroom clean laundry done shit was looking like a war zone in here
1,obama declares disaster for typhoon devastated saipan obama signs disaster declaration for northern marians a
1,watch this airport get swallowed up by a sandstorm in under a minute
1,christian attacked by muslims at the temple mount after waving israeli flag via pamela geller
0,@sterlingknight who had a car crashsterling who was driving in the carmel or joeysterling knight
1,baltimore city i 95 north at mp 548 fort mchenry tunnel bore 3 collision i 95 north at mp 548 fort mchenry tunnel bore 3 nort
1,oso washington mudslide response interview part 1
0,fatal attraction is common n what we have common is pain
0,check this deal sivan health and fitness basalt lava hot stone massage kit with 36 piece
0,free kindle book aug 3 7 thriller desolation run by @jamessnyder22
1,lt kyodonews gt update1 hiroshima marks 70th a bomb anniv amid fears of eroded pacifism #followme #japan
1,investigators say a fatal virgin galactic spaceship crash last year was caused by structural failure after the co
0,but even if the stars and moon collide i never want u back into my life #mtvhottest justin bieber
0,louis vuitton monogram sophie limited edition clutch cross body bag full read by ebay
0,smoke the weed snoop lion ft collie buddz
1,check out malaysia confirms plane wreckage is from flight mh370 at
0,@danagould @waynesteratl i agree with background checks i just think guns or weapons in general are the great equalizer
1,virgin galactic crash early unlocking of brakes triggered structural failure the crash of a virgin galactic
0,the government is concerned about the population explosion and the population is concerned about the government explosion joe moore
0,#cancer everything seems catastrophic you feel you can not be worse hit rock bottom you recover you start again after a while got it
1,severe storm weakening as it moves se towards lubbock area outflow boundary may create dust and 50 mph gusts
0,wrecked emotions
1,llf talk world news us in record hurricane drought the united states hasnt been hit by a major hurricane in
0,whats up man
0,hail the user summons a hailstorm lasting five turns it damages all pokemon except the ice type
0,#hot funtenna hijacking computers to send data as sound waves black hat 2015 #prebreak #best
1,sydney hostage crisis has now been recovered from the airasia wreckage
0,@saku uchiha @ya boi luke screams and gets a face full of saku genitals
0,@spinningbot are you another stand user if you are i will have to detonate you with my killer queen
0,top link reddits new content policy goes into effect many horrible subreddits banned or quarantined
0,i screamed at the end oamsgajagahahah im laighign #otrametlife
0,surveillance video captures man removing american flag from long beach home ktla
0,exofficio mens boxer brief curfew large
1,@gigagil iof murdered over 513 palestinian children 70 under 12 during gaza massacre where was zionist morality zionism is a world evil
0,@j3lyon im going to put the ffvii ones out at the weekend so i think pandemonium dont forget the exclamation mark would be midweek
1,35w memorial honoring those who died when the bridge collapsed
0,stop saying i wish and start saying i will unknown
0,@benaffleck i respected you and liked you for your talent i guess i stil do but as a human being youve sunk low mraffleck
1,driver rams car into israeli soldiers wounds 3 military a driver rammed a car into a group of israeli soldi
0,psalm34 22 the lord redeemeth the soul of his servants and none of them that trust in him shall be desolate
0,@troylwiggins i screamed
0,housing starts explode to new heights
0,he called it a mudslide aw
0,but oh how rich the soil how wonderful the upheaval @entershikari
0,not being able to touch anything or anyone in penneys without being electrocuted
0,uribe just obliterated a baseball
1,severe thunderstorm warning issued august 05 at 9 31pm cdt until august 05 at 10 15pm cdt by nws
1,tommygshow burlington county offers to purchase landslide damaged properties in florence
0,julie r is the apocalypse version of romeo juliet #warmbodies
0,@mockingpanems @cuddlesforjen what if he slammed her against the wall for the wrong reason but then he came out of hijack mode and it
0,i was obliterated last night
1,katunews #sr14 remains closed as brush fire burns 1700 acres #liveonk2
1,memorial unveiled for travis county deputy jessica hollis who was killed in sept flooding
1,#aus aircraft debris found on island is from mh370 malaysia confirms #abc
0,what progress we are making in the middle ages they would have burned me now they are content with burning my books sigmund freud
0,rubs lamp greets genie just need the 1 wish thanks pls obliterate anyone who has used the hashtag #youcantsitwithus
1,#japan marks 70th anniversary of #hiroshima atomic bombing from @ap
0,currency transgress before payday prison ward sinking fund payment unsecured loan jbumzqpk
0,new name mudslide
1,courageous and honest analysis of need to use atomic bomb in 1945 #hiroshima70 japanese military refused surrender
1,bombing #iran would result in a never ending game of #nuclear whack a mole heres why
1,udhampur terror attack nia takes over probe pakistani terrorist quizzed pak denies link #elections #achedin #
1,good way to end the day geyser plus dust storm
1,another movie theater attackclose to home this time thankful for no casualties life will go on because we cannot allow evil to win
0,@devon breneman hopefully it doesnt electrocute your heated blanket lmao
1,the cryptic words that guided pilots on the hiroshima bombing mission #canada
1,the latest more homes razed by northern california wildfire
0,@walpurgisnightz i was thinking super glue since its not as messy
0,detonation fashionable mountaineering electronic watch water resistant couples leisure tab
0,buyout giants bid to derail 6bn worldpay ipo sky news
0,this man @zvch4 about to start body bagging these local jokal photographers
1,man found dead in demi moores swimming pool
0,why are people panicking about results day though hahahah like worrying is going to change your results
0,ibrahimovic amp hazard boot test nike mercurial vapor x test footballfreestyle24 7 via @youtube
1,reported hit amp run in roadway property damage at 15901 statesville rd
1,richmond police officer wounded suspect killed
1,strong thunderstorm 4 miles east of pickens moving ne at 20 mph pea size hail and wind gusts up to 40 mph #scwx
0,i lava you
0,i liked a @youtube video romanatwoodvlogs rescued sick kittens
0,body bagging bitches
1,ca cops illegal immigrant with 4 prior arrests charged in fatal sex attack
1,omfg there are bush fires all over this tiny island our freaking house is gonna burn down
0,ems1 ny emts petition for 17 per hour minimum wage #ems #paramedics #ambulance
1,news islamic state claims suicide bombing at saudi arabian mosque
1,map shows where all of californias wild#fires are burning this map created by cal fire
0,@vivigraubard of course not for efforts to address short sideness beyond not including a graf would derail obvious backtracking efforts
1,blog rain much needed as drought conditions worsen right now charlotte and much of the surrounding area have
0,im over here listening to bloody jay
0,@kurtschlichter grandpa fought his way across western eurpoe mustered out in guam on his way to the home islands bounce the rubble
1,@royalcarribean do your passengers know about the mass murder that takes place in the #faroeislands every year
0,just had a heart attack because i thought my goat was dead dont worry rocket is okay
1,hundreds of commuters abandoned at lrt station during severe hailstorm
0,i just screamed in 57 languages this is so good
0,reddit will now quarantine offensive #onlinecommunities #reddit #amageddon #freespeech
0,back in 02 to 03 would never said that 50 would have ended ja like obliteration
0,320 ir icemoon aftershock @djicemoon #dubstep #trapmusic #dnb #edm #dance #ices
1,watch this airport get swallowed up by a sandstorm in under a minute
1,a subcontractor working for french seismic survey group cgg has been kidnapped in cairo and is held by islamic state the company said on w
0,rt geek apocalypse 4pm gmt hesse plays dark souls 2 day 9 #etcpb
0,gates not body bagging nobody niggas in br really know who he is
1,remembering rebecca roga 40 of the philippines murdered by hamas terrorists in the suicide bombing of egged bus no 361
0,im sitting in the parking lot waiting to go into therapy and im crying and an emotional wreck and i dont want my therapist to know
1,families to sue over legionnaires more than 40 families affected by the fatal outbreak of legionnaires disea
0,1860 bloods penny post philly octagonal cds 1 black 15l18 grid cancel #26
1,severe thunderstorm warning for oklahoma county in ok until 10 30pm
0,#news cramer igers 3 words that wrecked disneys stock #til now #cnbc
0,this bowl got me thinking damn ive been blazing for so damn long
0,my biggest fear is disappointing the people who believe in me
0,no lender fees for veterans or first responders past and present on @linkedin
0,he just wrecked all of you
1,officials rescue 367 migrants off libya 25 bodies found fox news #noagenda #mvdint
0,wooooooo rt @gamerant call of duty black ops 3 esports mode lets players ban weapons
0,@fouseytube you ok need a ambulance hahahah that was good
0,one direction is my pick for fan army #directioners x1435
1,los angeles times arson suspect linked to 30 fires caught in northern #newsintweets
1,horrible accident man died in wings of airplane 29 07 2015
1,#thesun flood two people dead 60 houses destroyed in kaduna two people have been reportedly killed and 60 h
0,get access to the most extensive sources of threat information right out of the box then easily add your own internal intelligence #bhusa
0,official kinesiology tape of ironman long lasting durability effectiveness on common injuries
0,@thelegendblue @cozmo23 theyll probably allow us to ascend them but not get them to the damage max values
1,@doricreates @alhanda seems gov moonbeam between tokes blames bush for all the fires
0,@dr baseball41 @granttamane8 @drewwtaylor @dtop77 on the christie hillside game 4 pandemonium at the pits
0,zone of the enders mgs2 god of war rt @d pagexxi quote this with your favorite ps2 game
1,9 mile backup on i 77 southaccident blocking the right 2 lanes at exit 31 langtree rdconsider nc 115 or nc 150 to nc 16 as alternate
0,the idea of an album that is entirely zayn just sunk in to me and im loving it
0,cracker white riot #nowplaying
0,poor jack
0,when you say call dad but your phone dials emergency services #awesomejobsiri
0,who said this yosemite sam or drumpf nobody ill vote for a flattened out rabbit skin a huh huh i always say
0,bayelsa poll tension in bayelsa as patience jonathan plans to hijack apc pdp plans by former first lady and
0,rt @freediscountbks desolation run #free till 8 7 #military #thriller #suspense #kindle #amreading
1,chesterfield apartment complex evacuated because of fire #stl
1,the rocky fire burning in ca still threatening more than 7k buildings largest in state amp one of nearly 2 dozen burning now #9newsmornings
1,93 blasts accused yeda yakub dies in karachi of heart attack #mumbai
1,500 deaths a year from foodborne illness @frackfreelancs dears @deccgovuk @frackfree eu @tarleton sophie
1,quarantine enforced isolation to prevent contamination that could lead to disease or in some cases death
0,hey look kashs foundation live for today got blown up on people magazines website todd blake
1,jerry brown declares state of emergency over wildfires drought street gangs radiation dead fish lgbt mania air pollution unemployment
0,@sbjohn12 im still waiting for one of these trailers to make up for the mets btm 9th 2out rain delay come back give up 3 runs meltdown
1,wreckage conclusively confirmed as from mh370 malaysia pm investigators and the families of those who were
0,who makes these
0,camilas doing a follow spree tonight im screaming of happiness
1,watch mother nature halts australia blue mountains bushfire
0,@babybackreeve fatality
0,weapons catalogue
