target,text
1,my happy pensioner stories safe buildings watching a report on unsafe cladding catching fire in melbourne same
0,tracy blight thank you for following me
0,when life is cheap evil abounds and @ppact @hillaryclinton profit from its destruction#defundpp
0,rt rabidmonkeys1 ah the unique mudslide cake #gbbo
1,#computers #gadgets two giant cranes holding a bridge collapse into nearby homes #slingnews
1,airplane crashes on house in colombia 12 people die in accident
1,circus tent collapses in violent storm killing 2 kids in new hampshire
1,cooler weather helps crews battling state wildfire related articles
0,@underrrtow molly send help im panicking over 6th form clothes what do i do
0,@jassy curtis wait im fckng obsessed with your song sirens
0,i added a video to a @youtube playlist panic at the disco i write sins not tragedies official video
0,@raidersreporter @957thegame together we can destroy the emperor and rule the galaxy father and son
0,the road to success is paved with pennies that i flattened on the train tracks youre welcome
0,#360wisenews chinas stock market crash are there gems in the rubble
1,turkish troops killed in kurdish militant suicide attack
0,its always super awkward when worlds collide
0,hail mary full of grace the lord is with thee blessed art thou among women and blessed is the fruit of thy
0,germany has 39 gigawatts of installed solar capacity one gwatt is about equal to the capacity of a nuclear reactor
0,if a 1 rise in wages is going to have such a catastrophic impact on wage structure what the fuck is automation going to do
0,canberras first mr fluffy homes demolition schedule released
0,robert ballews log statements are always at the fatal level
1,watch this airport get swallowed up by a sandstorm in under a minute
0,@thedreaminggoat @mayhem0407 @robertosaguedes mayhem is my husband by the way
0,photo prettyboyshyflizzy lol she trapped them into that so beautifully
0,@googlefacts wounds heal faster if you lick them tears also help them heal as well i know right even thou it seems stupid when lickin
0,trust us to get rescued by the dopey ones #emmerdale #summerfate
0,#meditationbymsg 45600 ppl got method of meditation in up amp got deluge of divine blessing 4 happy n peaceful life
0,because you watched honey i blew up the economy we recommend the conservative shoppe of horrors #harperanetflixshow #elxn42 #stopharper
0,@nathanfillion hardly
0,no dont tell me that
1,rt @livingsafely nws posts severe #thunderstorm warnings for parts of #ar #nc #ok seek strong shelter if at risk
0,by the grace of god i survived the 2am shift and im not that tired
1,new nyc legionnaires disease death toll rises #follow
0,i added a video to a @youtube playlist siren 1 gameplay walkthrough part 1
0,i always tell my mom to bring me food or i will hold her cat hostage
1,#earthquake #sismo m 19 15km e of anchorage alaska time2015 08 06 00 11 16 utc2015 08 05 16 11 16 08 00
1,suicide bombing at location named #premonitions
0,what a wonderful day
0,for those that were interested in the gun powder art discussed at the end of introduction to theological aesthetic
0,@a cee daem girl smooth asf c
0,one day i want someone to run for the ferry fall and crack there face open for almost knocking me over just to get on a boat
1,reality training train falls off elevated tracks during windstorm
0,#onceaho empire girl vote abella danger adult empire is running their first ever hunt for the emp #alwaysaho
0,back home they mad cause i chill with the white boys
1,las vegas in top 5 cities for red light running fatalities news3lv
1,#dnr res buildings shelled amp on fire in #gorlovka tonight civilian casualties jan july 2015 164 killed incl 16 children 501 wounded
0,in my experience if youre always angry and critical as a pundit you are in grave danger of going off the rails 1
0,@bonhomme37 wouldnt that have sunk the sub
0,rasaudauthor #pyrotechnic #artwork by #caiguoqiang explodes into a blossom on the steps of the #philadelphiamuseu
0,blaze is my bro
0,@drag0nking0201 screams dont scare me and its animatronics
0,remove the and linkury browser hijacker
1,#grupdates pic of 16yr old pkk suicide bomber who detonated bomb in turkey army trench released gt
0,@teamvodg discovered by @nickcannon listen buy @realmandyrain #riot on @itunesmusic @itunes #blowmandyup
1,severe thunderstorm warning for oklahoma county until 10 30pm radar here #okwx
1,the latest more homes razed by northern california wildfire abc news
0,@thetimepast @saalon i have childhood trauma more resolved than theirs actual trauma fricken babies
0,@maatmhi slightly diff catastrophe amp barry was running solo but generally the same thing
0,i just got screamed at for asking my dad to move half a step so i could get through
1,two buildings involved in fire on 2nd street in #manchester @wmur9 #wmur
0,its lights out again with stage two load shedding stage two load shedding will be in force between 5pm and 10pm
1,riot police intervene after southampton and vitesse arnhem supporters clash fans clash in buildup to second
1,usgs reports a m194 #earthquake 5km s of volcano hawaii on 8 6 15 @ 1 04 01 utc #quake
1,he is one of the three survivors of the destruction of otsuka village
0,i liked a @youtube video from @skippy6gaming minecraft ps4 3 x 2 lava door how to tutorial ps3 xbox
0,@bigbang cbs wowokumthat was like ice water blizzard snowstorm to the face
1,bushfire causes first victim in albania the multiple fires in albania have caused the first vict #bush
1,#children traumatised after the nepal earthquake are educated on coping mechanisms
0,for maximum damage activate big band mode for old timey obliteration
1,abc news the latest more homes razed by northern california wildfire abc news the latest on
1,violent video ukraine rioters brutally beat police storm local admin building were all fighting back
1,flood advisory issued august 05 at 4 35pm edt by nws #wxky
1,we all complain about pa but atleast we dont have those wild fires taking our homes like north cali or the floods in florida right now
1,tractor trailers collide on nj turnpike 42
1,@cityofcalgary activates emergency plan amid severe thunderstorm warning #yyc #abstorm
0,if tyuler collins could become andy dirks before the 58 injuriesthat would be uiseful
0,apparently my face screams get me emotionally attached and then cheat on me
0,seen on fahlo #wcw all hail the queen
0,love my girlfriend
0,quality metrics penalties may harm patient care pcps say primary care physicians generally hold positive vi
0,@reinhardbonnke is preaching on the holy spirit holy spirit blows atmosphere to pieces atmosphere is air in a jar the hs is a hurricane
1,@sakhalintribune calgary area tornado warnings end as thunderstorms move eastward
1,the catastrophic effects of hiroshima and nagasaki atomic bombings still being felt today
0,@sandy0013 dude i have a crush on hockey players but paul will always give me butterflieshes just an angel
1,property losses from northern ca wildfire nearly double if you pray please remember ca people forests wildlife water
1,families to sue over legionnaires more than 40 families affected by the fatal outbreak of legionnaires disea
1,british trekkers rescued amid flash floods in himalayas bbc news
0,@mollywood i agree i didnt know you had moved to marketplace i woke up to your report amp thought my favorite worlds bol apm collided
1,shock report muslims setting wildfires across american westarson jihad
1,twelve feared killed in pakistani air ambulance helicopter crash reuters #yugvani
0,i liked a @youtube video from @team0epiphany gta 5 mods new tsunami mod gameplay huge waves shark hunting
1,report 5 18 22 45 ibaraki prefecture offing m55 depth 60km maximum seismic intensity 4 #earthquake
0,@sammysosita smoke a blunt amp get through it no more ciggs for you
1,wo pic of 16yr old pkk suicide bomber who detonated bomb in turkey army trench released
0,whats going on in hollywood #abc7eyewitness @abc7 helicopters and sirens #hometownglory
1,wreckage conclusively confirmed as from mh370 malaysia pm investigators and the families of those who were
1,severe weather statement issued august 05 at 9 33pm cdt by nws the severe thunderstorm warn #skywarn #okwx
0,lil more i did want a stretcher yc
0,bloody nurses waking me up just when i eventually fall asleep lol #hospital
0,i hate when im trying to straighten my hair and my brother comes swooping in behind me and scares me i just burned my finger
1,twelve feared killed in pakistani air ambulance helicopter crash
0,my lifelong all time favorite song is landslide this song has gotten me through a lot of though times amp
0,@deeeznvtzzz bring the body bags tho
1,russian food crematoria provoke outrage amid crisis famine memories
0,@ariabrisard @leiaorganasolo good play along with her you may begin your operation with the death star the evacuation is nearly complete
0,ignition knock detonation sensor senso standard fits 02 06 acura rsx 20l l4
0,why are you engulfed by low self image take the quiz
0,want twister tickets and a chance at a vip experience to see shania click here
0,i apologise sincerely for the inevitable deluge of #gbbo tweets to come i wont hold any grudges if you decide to unfollow #baking #cakes
0,beyonce is my pick for fan army #beyhive 78
0,how can someone harm this angel
1,@nataliealund parents of colorado theater shooting victim fear copycat massacre #antioch
0,i dont get waves of missing you anymore theyre more like tsunami tides in my eyes
0,lizard wizard in a blizzard #lwb
1,insane bush fires in california be safe
1,13 security personnel killed in iraq suicide bombing
0,i dont think ive forgiven angelina jolie yet sef
1,soon to be loud bang as backpack detonated
1,the catastrophic effects of hiroshima and nagasaki atomic bombings still being felt today
1,man crushed to death by own car
1,natural disaster news stories about natural disaster page 1 newser
1,cant fix stupid mt @cbccalgary dont drive through flooded underpasses warns city as it enacts municipal emergency plan #yyc #abstorm
0,the 8 minute fat burning routine that s also really fun #fat weightless # fatburning #burnfat #skinny #workout
1,#world fears over missing migrants in med rescuers search for survivors after a boat carrying as many a #news
0,coldwood is blown away by your support they even hung up some of your art
0,if u faved that i hope you fall off a cliff
1,agricultural buildings on fire aldwark nyorks fire amp rescue service still grim news but fewer piglets caught up
1,timesnewsdesk police link beach massacre to tunisia museum attack
1,two new bitterroot national forest fires are largest for forest so far this year
0,crackdown 3 destruction restricted to multiplayer crackdown 3 impressed earlier this week with a demonstratio
1,hiroshima one of historys worst examples of mass murder #hiroshima #war #atombomb #japan
0,i liked a @youtube video from @deathmule mk x tremors stalag might fatality on ermac tournament pharaoh
1,maryland mansion fire that killed 6 caused by damaged plug under christmas tree report says into the flames
1,@themagickidraps not upset with a rally upset with burning buildings businesses executing cops that have nothing to do with it etc
0,our doctors and nurses in the new pediatric emergency department are all specialized in child services
1,#hiroshima does not look like a bombed city it looks as if a monster steamroller had passed over it and squashed it out of existence
1,heavy smoke pouring out of buildings on fire in port coquitlam
0,i screamed when @g montani @jessemontani were running to john for 1st place im so happy i love you guys #amazingracecanada
0,august 5 1620 one hundred odd pilgrims from england and holland set sail for the new world they were unimpressed
1,i cant believe blevins got injured falling off a curb thats something that would happen to me never it expected for a pro player
1,two trains have collided in india please pray for victims their families and rescuers
0,jumps off of a cliff while drinking tea this is how british people fall off cliffs
1,rocky fire #cali #scfd #wildfire #lakecounty
0,@guy reginald lol more than welcome
0,get a 50 eur free bet at bwin to use on all sports markets #destroy #free
0,my school is so fucking dumb they just set off the evacuation sirens on accident
1,bomb crash loot riot emergency pipe bomb nuclear chemical spill gas ricin leak violence drugs cartel cocaine marijuana heroine kidnap bust
1,#breaking 10th death confirmed in legionnaires outbreak in south bronx total cases reaches triple digits
1,@kabarmesir @badr58 never dies a big crime like rabaa massacre as long the revolution is being observed #rememberrabaa
0,@dustpiggies ah i was awash with abstract dustpig tweets then explains the deluge
1,heat wave adding to the misery of internally displaced gazans via @presstv
1,the guardian islamic state claims suicide bombing at saudi arabian mosque
1,isil claims suicide bombing at saudi mosque that killed at least 15
0,@badastronomer i have a lot of trouble getting both students and adults to understand that the moon is farther away than they think
0,i added a video to a @youtube playlist futuristic house built to survive the apocalypse minecraft maps
1,the terrorist tried to get out of the car i shot him
1,watching it go up in flames
1,lightning
0,i cant believe a fucking cis female is going to somehow claim to be offended over a transgendered female whos been attacked by media
0,my boy @fall off cliff still got it man rumor has it he going back to de
1,urgent save the salt river #wildhorses mass murder by the very ppl supposed to protect them gt @cnn @cbc
0,@emiiliexirwin totally agreeshe is 23 and know what birth control isi am not saying it is true want to derail their plan of blaming fans
0,the #bible sometimes backs up the truck and unloads a descriptive deluge of indecency on us @chuckswindoll explains why on @iflcanada next
0,13 m chapoutier crozes hermitage so much purple violets slate crushed gravel white pepper yum #france #wine #dc
0,320 ir icemoon aftershock @djicemoon #dubstep #trapmusic #dnb #edm #dance #ices
1,hiroshima survivors fight nuclear industry in brazil video
0,join the providence health amp services team see our latest #nursing #job opening here #torrance ca #hiring
1,ll ll pic of 16yr old pkk suicide bomber who detonated bomb in turkey army trench released
1,collection of articals and video of west coast wild fires by @abc
1,oh god diane is following them to the hostage exchange in a taxi #randomactsofromance
0,screams at my own mother
0,i just got electrocuted by my #hp chromebook charger it sparked and caught fire #hp
0,im getting a car wow it hasnt sunk in
1,#map typhoon soudelors predicted path as it approaches taiwan expected to make landfall over southern china by
0,@arianagrande @justinbieber im screaming omg #idols #22days #wdym
0,@erpestar i aint a bitch girl popobawa revolves around you the cyclone
1,#epao marsac reports on manipur flood heavy incessant rains in manipur have led to inundation causin #manipur
1,the death toll in a #is suicide car bombing on a #ypg position in the village of rajman in the eastern province of hasaka has risen to 9
1,city implores motorists not to speed after more reports of animal fatalities near nature reserves gt
1,a house was evacuated in orakei after a bank collapsed and trees were felled by strong winds in auckland #nz
1,i just want everyone to know that emilee was worried i was getting a milkshake when we were supposed to evacuate
1,watch this airport get swallowed up by a sandstorm in under a minute
0,320 ir icemoon aftershock @djicemoon #dubstep #trapmusic #dnb #edm #dance #ices
0,government under pressure to abandon plans to construct uk s first nuclear reactor for more than 20 year
0,screams internally
0,#du19 who gon get in this rap battle with me
0,@wuckforld @lioniskingrtac to be alive even a heroic famine drink look out
0,detonation fashionable mountaineering electronic watch water resistant couples leisure tab
1,read an eyewitness account from #hiroshima from this day in 1945 #life
0,temptation always leads to destruction
0,hello twitter i need some book bloggers and interviews regarding my book weapons formed against me #ineedexposure
0,is stuart broad the prime minister yet best thing in sport i have seen for years that the aussies look devastated bless
1,international news nigeria suicide bomb kills at least seven at market via @233liveonline full story at
0,2015 new fashion ladies gold watch waterproof weiqin famous brand michel quartz de lujo ca
0,@kiwi karyn check out whats in my parking lot he said that until last year it was an ambulance in st johns
0,@asymbina @tithenai im hampered by only liking cross body bags i really like ella vickers bags machine washable
1,experts in france begin examining airplane debris found on reunion island french air accident experts on wednesday began examining t
0,devastated isnt the word ross out of all people #emmerdale #summerfate
0,walmart is taking steps to keep children safe in hot vehicles take a look at the innovative car seat here
0,def louis is tired plus the meltdown of fans when he confirmed hes a dad but some fans are reaching making conclusions and stuff
1,share large sinkhole swallows entire pond in lowndes county georgia a large #yonews
0,try not eating like a fat ass rt @ineedja kadeeja how much would it cost to have some fat displaced asking for a friend
0,@datshemmings moi cest plutot disconnected the only reason close as strangers heartbreak girl rejects social casualty ufhguhfidt
0,@abcnews uk scandal of 2009 caused major upheaval to parliamentary expenses with subsequent sackings and prison what are we waiting for
1,interesting mh370 aircraft debris found on la reunion is from missing malaysia airlines abc o please rt
1,one year on from #is massacre in #sinjar yazidis blast lack of action over 3000 5000 yazidis who remain enslaved
1,6th july 1945 hiroshima was bombed with nuclear weapon bomb was named little boy amp carried in a plane called enola gay 1 2
0,please like and share our new page for our indoor trampoline park aftershock opening this fall
0,jordan son of mars hot lava release on 07 22 2015 for 160 via #kofapp
0,back to back like im on the cover of lethal weapon
1,elem pomo helping the displaced from the rocky fire please consider elem evacuation center via @gofundme
0,lunch for the crew is made night night its been a long day peace love rescue
1,faan orders evacuation of abandoned aircraft at mma faan noted that the action had become neces via @todayngr
0,check out #preppers #doomsday must have library collection on cd #shtf #preppertalk #survival #2a #prepper via @ebay
0,@casper rmg u on dick
0,hamptonroadsforme us navy sidelines 3 newest subs
0,photoset littlebitofbass silinski ed sheeran on the hobbit the desolation of smaug german premiere
0,we all carry these things inside that no one else can see they hold us down like anchors they drown us out at sea
1,pkk suicide bombing kills 2 soldiers in turkey
0,home2 suites offices are coming to salvis bistro site the former salvis bistro will soon be demolished to make
0,i would love to #win suzes amazing filled #beauty #bag #giveaway contents from loccitane body shop amp lavera
1,inec office in abia set ablaze
1,isis are deploying their troops to other battle grounds since deal with turkey to evacuate buffer zone areas hence moving fronts to assad
0,now i am quietly waiting for the catastrophe of my personality to seem beautiful again and interesting and modern
0,the whirlwind scourge of europe rt @whedonesque or you could just watch the fanged four
1,typhoon soudelor taking dead aim at taiwan
0,i just screamed when i saw jordan come out the door behind donnie on #wahlburgers
1,nws flash flood warning continued for shelby county until 08 00 pm wednesday #tnwx
1,the bush fires in ca are so crazy
0,my dog attacked me for my food #pugprobs
1,netnewsledger wild fire update august 4 2015 thunder bay weather there were no new fires confirmed by t
1,this is the first year the forest service spent more than half its annual budget on fighting fires #climatechange
1,truck catches fire in warwick a tree service truck caught fire around 7 15 pm on wednesday in warwick on in
1,nigeria rainstorm destroys 600 houses in yobe state daily trust damaturu over 600
0,my ears are bleeding
0,the art worlds seismic shift back to the oddball observer
1,here is goes again #abstorm #hailstorm #yychail stay safe everyone
1,the denver post motorcyclist bicyclist injured in denver collision on broadway
0,sometimes god uses sorrowful tragedy to set the stage for glorious redemption david platt run for
0,@awadgolf @gop a capitalist would win biggest landslide in history people who havent voted in years even old school dems would elect him
0,the great upheaval by winik jay
0,in @edfringe we highly recommend @m00nf00l #titania @summerhallery a whirlwind reimagining shakespeares midsummer
0,#insanelimits #plugin enabled @ tps tdm 400t hardcore locker weapon rules using 3 limits
0,burned 202 calories doing 30 minutes of walking 40 mph very brisk pace #myfitnesspal
0,market news activision blizzard cognizant technology first solar
1,families to sue over legionnaires more than 40 families affected by the fatal outbreak of legionnaires disea
0,@marquisdespade you can tell yer sins to me i wont judge you take your clothes off and we can sing a hymn lets do abba @tornado chick
1,jet fuel cant melt steel the structural failure is illogical the second plane crashing into the building is fake it was a bomb
1,the cryptic words that guided pilots on the hiroshima bombing mission
0,us national park services tonto national forest stop the annihilation of the salt river wild horse via @change
1,may allah help all those suffering from the #pakistan floods you and your families are in our #dua
0,@vpzedd reach skype
1,ntsb virgin galactic crash caused by structural failure triggered when brakes unlocked early
0,the eden hazard of hockey
0,everyones wonder who will win and im over here wondering are those grapes real #bb17
0,have you heard 05 love to love youheat wave vol 5 by george deejayempiresound on #soundcloud #np
0,#charminar demolish if it in falling state anyway take engineers opinion #telangana
0,@5hvzlaradio love what you picked were playing worth it by fifth harm kid ink because of you listen amp vote
0,@meekmill i think its time you consulted @kendricklamar cause @drake done body bagging you
1,rt @livingsafely nws posts severe #thunderstorm warnings for parts of #ar #nc #ok seek strong shelter if at risk
0,survived spanish @ sweet ritual
1,#bestnaijamade 16yr old pkk suicide bomber who detonated bomb in bestnaijamade bestnaijamade bestnaijamade be
1,turkish troops killed in kurdish militant suicide attack
1,#sigalert north amp southbound 133 closed btwn 5 fwy and irvine blvd due to truck fire chp is detouring traffic
0,mo the way she says carry
1,twin storms blow through calgary 1
0,pop quiz which do you prefer feminist revolution or fried ravioli with porcini and ricotta
1,evacuation order lifted for town of roosevelt
0,san onofre nuclear reactor waste to be buried under shoreline using 3 billion in tax payer dollars
1,myanmars president urged people to leave a low lying southern delta region on thursday with rain water that has inundated much of the coun
1,green line trains resume service after south side derailment green line service has resumed more than four h
0,i lava you
1,our deeds are the reason of this #earthquake may allah forgive us all
1,some of the aftershocks can be just as big as the initial earthquake
1,twelve feared killed in pakistani air ambulance helicopter crash
1,#usgs m 19 5km s of volcano hawaii time2015 08 06 01 04 01 utc2015 08 05 15 04 01 10 00 at epicenter #sm
0,man somebody gotta stop sbee dude too fuckin funny blood
1,#deai # # # suicide bomber kills 15 in saudi security site mosque reuters
0,i barely smoke with people i solo all my blunts
0,@gtiso fair enough change always has unfortunate casualties i like that @nzmorningreport utilises both welly amp aucklnd well see
1,kakeru teduka bfore 70years of today in hiroshima its exploded the one atomic bomd it is so sad day
1,70 years after atomic bombs japan still struggles with war past the anniversary of the devastation wrought b
0,freyas video blew up everywhere
1,whao pic of 16yr old pkk suicide bomber who detonated bomb in turkey army trench released
1,hiroshima prepares to remember the day the bomb dropped
1,hurricane guillermo live noaa tracking looping wedaug5th
1,wreckage conclusively confirmed as from mh370 malaysia pm investigators and the families of those who were
0,god bless you and your mudslide cake dorret
1,view of smoke column rising above the south end of the blake fire along forest road 1 #routecomplex
0,so if i capsize on your thighs high tide b 5 you sunk my battleship gt
0,#3 titan warriorcord 100 feet authentic military 550 paracord mil c 5040 h type iii 7 strand 5 16 di
0,men crush every fucking day
0,@iamhorsefly hide your kids hide your wife hes on the loose i thought i flattened you with a ball
0,calgary news weather and traffic for august 5 90
1,prayers for my cousin hes in california helping with the wild fires
1,news break nigeria rescuers search for survivors after a boat carrying as many as 600 migrants capsizes in the
1,#mightyworld thousands displaced after monsoon rains in myanmar tens of thousands of people have been displac
1,#breaking #la refugio oil spill may have been costlier bigger than projected
1,ballina emergency services have again been activated following a shark sighting of what has been described as two
0,i still dont know why independence day and social casualty are not on the rowyso setlist these songs would be so good live
0,whats wrong with just a lil smoke and good conversation
1,another mechanical mod explosion man injured when a pharaoh mod blows up in his hand
